{
  "assumptions": [],
  "catalog": [
    {
      "id": "G0001",
      "text": "polygamma(0, u)"
    },
    {
      "id": "G0002",
      "text": "polygamma(1, u)"
    }
  ],
  "current": "polygamma(0, u) + polygamma(1, u)",
  "difficulty": 2,
  "domain": "synthetic",
  "expected_verdict": "ZERO",
  "family": "deriv",
  "functions": [],
  "gold_types": [
    "derivative_family"
  ],
  "hidden_from_proposer": true,
  "hidden_gold": {
    "aux_names": [
      "PsiU"
    ]
  },
  "hidden_instance_maps": {
    "G0001": {
      "order": 0
    },
    "G0002": {
      "order": 1
    }
  },
  "hidden_r_level": "R6",
  "hidden_target_type": "derivative_family",
  "id": "test-a-deriv-family",
  "instance_maps": {
    "G0001": {
      "order": 0
    },
    "G0002": {
      "order": 1
    }
  },
  "ladder_id": "R6",
  "license": "author-constructed",
  "negative_tempting_structures": [],
  "notes": "order 0 and 1",
  "polarity": "positive",
  "provenance_hidden": "held-out polygamma derivative family",
  "r_level": "R6",
  "scientific_context": [
    "Exact source members are listed in the catalog. Cite only G#### ids.",
    "Propose a complete representation: type, members, latent object, operators, reconstruction, and checkable obligations.",
    "Do not invent aliases. Do not claim a final compact formula. Do not invent physical names."
  ],
  "source_expressions": [
    "polygamma(0, u) + polygamma(1, u)",
    "polygamma(0, u)",
    "polygamma(1, u)"
  ],
  "source_format": "sympy",
  "split": "test",
  "symbols": [
    {
      "name": "u",
      "real": true
    }
  ],
  "target_type": "derivative_family",
  "task": "representation_invention",
  "tier": "A",
  "version": "ssc-representation-bench-v0.1"
}
