{
  "assumptions": [],
  "catalog": [
    {
      "id": "G0001",
      "text": "S(mu, nu)*p(mu)*p(nu)"
    },
    {
      "id": "G0002",
      "text": "S(nu, mu)*p(nu)*p(mu)"
    }
  ],
  "current": "S(mu, nu)*p(mu)*p(nu) + S(nu, mu)*p(nu)*p(mu)",
  "difficulty": 3,
  "domain": "tensor",
  "expected_verdict": "ZERO",
  "family": "tensor",
  "functions": [
    "S",
    "p"
  ],
  "gold_types": [
    "tensor_generator"
  ],
  "hidden_from_proposer": true,
  "hidden_gold": {
    "aux_names": [
      "Sgen"
    ]
  },
  "hidden_instance_maps": {
    "G0001": {
      "perm": [
        0,
        1
      ]
    },
    "G0002": {
      "perm": [
        1,
        0
      ]
    }
  },
  "hidden_r_level": "R8",
  "hidden_target_type": "tensor_generator",
  "id": "test-c-tensor-family",
  "instance_maps": {
    "G0001": {
      "perm": [
        0,
        1
      ]
    },
    "G0002": {
      "perm": [
        1,
        0
      ]
    }
  },
  "ladder_id": "R8",
  "license": "author-constructed",
  "negative_tempting_structures": [],
  "notes": "orbit of one bilinear generator",
  "polarity": "positive",
  "provenance_hidden": "held-out tensor family under index swap",
  "r_level": "R8",
  "scientific_context": [
    "Exact source members are listed in the catalog. Cite only G#### ids.",
    "Propose a complete representation: type, members, latent object, operators, reconstruction, and checkable obligations.",
    "Do not invent aliases. Do not claim a final compact formula. Do not invent physical names.",
    "Indexed tensor expression. Index permutation may expose structure."
  ],
  "source_expressions": [
    "S(mu, nu)*p(mu)*p(nu) + S(nu, mu)*p(nu)*p(mu)",
    "S(mu, nu)*p(mu)*p(nu)",
    "S(nu, mu)*p(nu)*p(mu)"
  ],
  "source_format": "sympy",
  "split": "test",
  "symbols": [
    {
      "name": "mu",
      "real": true
    },
    {
      "name": "nu",
      "real": true
    }
  ],
  "target_type": "tensor_generator",
  "task": "representation_invention",
  "tier": "C",
  "version": "ssc-representation-bench-v0.1"
}
